on_page,title,location,type_of_job,deadline,applied
28,"Supply Chain Project Engineer 2021 - Lehigh Valley, PA","Upper Saucon Township, PA",Full-Time • Job,"June 30, 2021 9:30 PM",False
28,"Supply Chain Project Engineer 2021 - Lehigh Valley, PA","Upper Saucon Township, PA",Full-Time • Job,"June 30, 2021 9:30 PM",False
28,"Project Manufacturing Engineer 2021 - Lehigh Valley, PA","Upper Saucon Township, PA",Full-Time • Job,"June 30, 2021 9:30 PM",False
28,"Project Electrical Hardware Engineer 2021 - Lehigh Valley, PA","Coopersburg, PA",Full-Time • Job,"June 30, 2021 9:30 PM",False
28,"Project Mechanical Engineer 2021 - Lehigh Valley, PA","Coopersburg, PA",Full-Time • Job,"June 30, 2021 9:30 PM",False
28,"2021 - Summer - Consulting Associate - Risk - Security, Privacy & Risk - Security Transformation","San Francisco, CA",Full-Time • Job,"March 1, 2021 1:30 AM",False
28,Social Media Manager,"New Haven, CT",Full-Time • Job,"March 1, 2021 11:30 AM",False
28,Computer Engineer,"Aberdeen Proving Ground, MD",Full-Time • Job,"April 1, 2021 2:30 AM",False
28,,WorldWide or United States,,,False
